{
  "schemaVersion": "4.3.0",
  "asOf": "2026-10-16",
  "classification": "UNCERTIFIED RESEARCH MATRIX — NOT LEGAL ADVICE",
  "scope": "28 jurisdictions and institutional systems × 16 intervention families; unpublished combinations intentionally marked not assessed.",
  "statements": [
    "No status is a finding of legal permission or endorsement.",
    "Authorizations and sanctions lists require live primary-source checks and competent professional review.",
    "Treat EU regulations and member-state enforcement rules as layered, not alternatives.",
    "Treat international humanitarian obligations as independently binding where applicable, not negotiable concessions.",
    "A discovered source portal is not the text of a governing legal provision.",
    "The matrix does not monitor law changes, issue licenses, or send diplomatic messages."
  ],
  "statuses": [
    {
      "id": "constitutional-conflict",
      "label": "Constitutional/sovereignty conflict",
      "description": "As framed, the proposal collides with an identified high-priority constitutional or sovereignty constraint.",
      "priority": 5
    },
    {
      "id": "restriction-screen",
      "label": "Sanctions / restrictions screening",
      "description": "Relevant official restrictive measures identified; specific transaction or counterparty must be screened by competent counsel.",
      "priority": 4
    },
    {
      "id": "authorization-gate",
      "label": "Specific authority / mandate required",
      "description": "Consent, approval, accredited implementation, or a new mandate is necessary before action.",
      "priority": 3
    },
    {
      "id": "standards-review",
      "label": "Framework or policy review required",
      "description": "Professional, treaty, or broad legislative framework identified; applicability and legal effects remain unverified.",
      "priority": 2
    },
    {
      "id": "not-assessed",
      "label": "Not assessed",
      "description": "No case-specific provision mapped. This is not a determination of compatibility or inapplicability.",
      "priority": 1
    }
  ],
  "mechanisms": [
    {
      "id": "local-plebiscite",
      "title": "Local territorial plebiscite",
      "sector": "sovereignty",
      "proposal": "A binding local referendum after a cooling period would purport to decide a change in Ukrainian territorial status.",
      "authorityQuestion": "Can a local vote lawfully change Ukraine’s territory, and who has competence?",
      "mandatoryChecks": [
        "Article 73 constitutional review",
        "Ukrainian nationwide authorization",
        "No occupation coercion",
        "International territorial-integrity norms"
      ],
      "tags": [
        "territory",
        "constitutional"
      ],
      "relatedOsIds": [
        "path-referendum-legality"
      ]
    },
    {
      "id": "un-administration",
      "title": "External transitional territory administration",
      "sector": "sovereignty",
      "proposal": "Hypothetical UN-administered interim economic-service zone within internationally recognized Ukrainian territory.",
      "authorityQuestion": "What Ukrainian consent, UN competence, and accountable mandate would be required?",
      "mandatoryChecks": [
        "Ukraine sovereign consent",
        "Any necessary UN mandate",
        "Protection of residents",
        "No implied recognition of unlawful annexation"
      ],
      "tags": [
        "sovereignty",
        "governance"
      ],
      "relatedOsIds": [
        "path-un-economic-zone"
      ]
    },
    {
      "id": "sanctions-relief",
      "title": "Staged Russia-related sanctions relief",
      "sector": "sanctions",
      "proposal": "Conditional relief for specified listed persons, entities, goods, or financial activity.",
      "authorityQuestion": "Which competent authority can amend, license or revoke the applicable restrictions?",
      "mandatoryChecks": [
        "Current consolidated sanctions",
        "Persons and beneficial ownership",
        "Specific applicable prohibitions",
        "Competent licensing authority",
        "No relief from duties toward civilians"
      ],
      "tags": [
        "sanctions",
        "licensing"
      ],
      "relatedOsIds": [
        "armistice-verified-incentive"
      ]
    },
    {
      "id": "immobilised-principal",
      "title": "Transfer of immobilised sovereign principal",
      "sector": "finance",
      "proposal": "Proposed transfer of restricted Russian sovereign principal to a reconstruction vehicle.",
      "authorityQuestion": "Can the custodian and relevant states lawfully transfer principal, considering immunity, title and litigation?",
      "mandatoryChecks": [
        "Assets vs earnings distinction",
        "Sovereign immunity",
        "Custody jurisdiction",
        "Domestic and EU statutory authority",
        "No presumed money availability"
      ],
      "tags": [
        "sanctions",
        "assets"
      ],
      "relatedOsIds": [
        "damage-to-investment-pipeline"
      ]
    },
    {
      "id": "extraordinary-revenue",
      "title": "Use of extraordinary earnings from immobilised assets",
      "sector": "finance",
      "proposal": "Use of legislatively allocated extraordinary revenues, distinct from title to frozen sovereign principal.",
      "authorityQuestion": "What binding instrument and appropriation permit collection, disbursement and use?",
      "mandatoryChecks": [
        "Current EU acts and budget authority",
        "Restrictions on destination",
        "Accounting and independent audit",
        "No double-counting"
      ],
      "tags": [
        "assets",
        "finance"
      ],
      "relatedOsIds": [
        "reparations-ledger"
      ]
    },
    {
      "id": "restricted-joint-investment",
      "title": "Joint civilian investment involving sanctioned actors",
      "sector": "finance",
      "proposal": "Hypothetical civilian consortium that includes or indirectly benefits restricted Russian persons or entities.",
      "authorityQuestion": "Are participants restricted and can resources legally be made available?",
      "mandatoryChecks": [
        "KYC/beneficial owners",
        "Sanctions and licensing",
        "Procurement and export controls",
        "Anti-corruption",
        "Ukrainian approval"
      ],
      "tags": [
        "sanctions",
        "finance"
      ],
      "relatedOsIds": [
        "industrial-voluntary-dividends"
      ]
    },
    {
      "id": "protected-exchanges",
      "title": "Protected-person exchanges and tracing",
      "sector": "humanitarian",
      "proposal": "Voluntary, rights-respecting release, tracing and transfer of detainees, wounded and seriously ill people.",
      "authorityQuestion": "Which humanitarian-law and domestic authorities regulate custody and safe transfer?",
      "mandatoryChecks": [
        "Geneva protections",
        "ICRC independent access where accepted",
        "Family notification and privacy",
        "No forced return"
      ],
      "tags": [
        "humanitarian",
        "rights"
      ],
      "relatedOsIds": [
        "path-wounded-exchange"
      ]
    },
    {
      "id": "weapons-separation",
      "title": "Reciprocal heavy-weapons separation",
      "sector": "security",
      "proposal": "Proposed conditional separation and monitoring of heavy weaponry around a cessation line.",
      "authorityQuestion": "What agreement, competent parties and independent monitoring mandate exist?",
      "mandatoryChecks": [
        "Reciprocal voluntary agreement",
        "No unilateral disarmament requirement",
        "Civilian safety",
        "Monitoring security and independent verification"
      ],
      "tags": [
        "ceasefire",
        "arms-control"
      ],
      "relatedOsIds": [
        "path-artillery-separation-30km"
      ]
    },
    {
      "id": "nuclear-safety",
      "title": "Nuclear facility safety perimeters",
      "sector": "nuclear",
      "proposal": "Civilian protection and repair access near nuclear facilities; not military enforcement by the IAEA.",
      "authorityQuestion": "Which facility access, national authorization and IAEA technical mandate are available?",
      "mandatoryChecks": [
        "Civilian nuclear safety mandate",
        "Host state authority",
        "Agreed access with all relevant controllers",
        "No imaginary IAEA military powers"
      ],
      "tags": [
        "nuclear",
        "security"
      ],
      "relatedOsIds": [
        "path-nuclear-safety-zone"
      ]
    },
    {
      "id": "ceasefire-mission",
      "title": "International ceasefire verification mission",
      "sector": "security",
      "proposal": "Independent incident-monitoring or sensor-based mission following an agreed ceasefire.",
      "authorityQuestion": "What UN, OSCE, national or other mandate exists now?",
      "mandatoryChecks": [
        "Fresh mandate and funding",
        "Host consent",
        "Neutrality and data minimization",
        "Incident dispute protocol"
      ],
      "tags": [
        "ceasefire",
        "monitoring"
      ],
      "relatedOsIds": [
        "path-sensor-verification"
      ]
    },
    {
      "id": "maritime-access",
      "title": "Protected civilian maritime transit",
      "sector": "humanitarian",
      "proposal": "Civilian-shipping corridor, AIS monitoring and de-risking measures compatible with navigation law.",
      "authorityQuestion": "Which coastal, flag-state, port and maritime authorities must agree?",
      "mandatoryChecks": [
        "Law of the sea and IHL",
        "Civilian navigation safety",
        "No disclosure of tactical sensitive movements",
        "Relevant shipping sanctions and insurance"
      ],
      "tags": [
        "maritime",
        "humanitarian"
      ],
      "relatedOsIds": [
        "path-maritime-civilian-corridor"
      ]
    },
    {